96,RM3,Salford Royal Hospitals NHS Trust,99,83,98,100,100,100,95,100,80,83,79,91,94,75,58,100,100,97,100,100,99,97,97,94,81,93,90,89,91,63,98,99,88,0,5,0,0,-3,0,5,-1,9,10,2,6,3,15,5,-6,"Stott Ln, Salford M6 8HD, UK",53.487482,-2.3238955
97,RNZ,Salisbury NHS Foundation Trust,61,32,73,80,80,35,45,67,25,25,16,69,32,25,25,38,75,56,15,50,77,43,82,67,19,,20,36,,54,63,55,46,-6,14,-10,-5,-24,-20,5,10,11,,3,13,11,-5,29,29,"Odstock Rd, Salisbury SP2 8BJ, UK",51.0452592,-1.7883697
98,RXK,Sandwell and West Birmingham Hospitals NHS Trust,55,37,30,65,65,60,50,33,45,33,8,61,38,17,29,64,90,78,70,67,87,51,64,48,3,34,30,50,64,54,75,78,44,23,7,45,25,13,10,17,54,5,1,-5,3,13,13,25,-16,"Hallam St, West Bromwich B71 4HJ, UK",52.5273566,-1.9878844
99,RCU,Sheffield Childrens NHS Trust,55,23,39,65,70,40,35,63,0,13,25,41,21,8,63,15,80,88,80,79,78,35,44,24,28,13,17,29,,63,55,81,32,26,9,16,15,18,40,44,15,29,0,3,3,14,9,0,9,"Clarkson St, Broomhall, Sheffield S10 2TH, UK",53.3804284,-1.4895067
100,RHQ,Sheffield Teaching Hospitals NHS Foundation Trust,82,35,68,90,90,85,80,67,55,17,18,62,29,42,38,21,95,91,80,75,70,61,80,70,44,36,45,61,70,67,73,82,59,0,24,5,5,1,-5,-5,3,6,19,26,18,32,3,29,49,"Royal Hallamshire Hospital, Glossop Rd, Broomhall, Sheffield S10 2JF, UK",53.379171,-1.4923035
101,RK5,Sherwood Forest Hospitals NHS Foundation Trust,67,45,64,69,40,55,70,100,40,50,11,74,31,33,54,67,95,75,80,83,89,46,88,70,15,57,50,70,73,75,83,84,60,17,15,19,26,35,25,13,-11,30,7,4,14,15,17,21,3,"Sutton Rd, Stockwell Gate, Nottingham, Mansfield NG18 5QE, UK",53.1419209,-1.2067011
102,RXW,Shrewsbury and Telford Hospital NHS Trust,60,33,52,69,75,50,55,50,50,19,3,51,42,25,38,32,69,63,55,58,68,42,56,48,3,25,25,50,68,42,67,63,40,3,7,15,0,-12,5,3,18,0,6,0,5,0,0,4,16,"Mytton Oak Rd, Shrewsbury SY3 8XQ, UK",52.7089717,-2.7926946
103,RTR,South Tees Hospitals NHS Trust,72,38,75,75,60,60,90,75,40,31,19,86,33,42,29,20,100,84,85,88,74,61,97,68,27,48,35,61,86,67,78,86,61,14,23,3,25,24,25,-2,-1,21,17,8,11,28,-7,38,48,"Northallerton DL6 1JG, UK",54.342627,-1.430376
104,RE9,South Tyneside Foundation NHS Trust,72,30,57,75,60,75,70,79,55,36,5,42,11,17,17,57,95,81,75,71,84,45,76,44,12,36,35,46,80,29,72,81,45,9,15,15,20,21,0,1,5,-9,0,7,34,34,18,12,-13,"Harton Ln, South Shields NE34 0PL, UK",54.9714091,-1.4277704
105,RJC,South Warwickshire NHS Foundation Trust,89,27,82,85,100,80,100,79,30,11,36,36,19,8,33,41,85,84,80,96,78,33,56,,14,,,,34,56,71,85,39,-4,12,-11,0,-16,0,-4,-1,,,-22,20,14,,23,,"Lakin Rd, Warwick CV34 5BW, UK",52.2886554,-1.5812981
106,RAJ,Southend University Hospital NHS Foundation Trust,88,56,77,80,90,75,100,96,45,44,57,81,55,58,25,80,90,91,75,100,91,67,94,72,75,43,65,55,59,30,88,89,62,1,6,11,10,1,0,0,-5,10,-1,18,13,12,7,5,-8,"Prittlewell Chase, Westcliff-on-Sea, Southend-on-Sea, Westcliff-on-Sea SS0 0RY, UK",51.5538593,0.6877328
107,RVY,Southport and Ormskirk Hospital NHS Trust,61,45,64,85,70,35,60,54,45,63,24,30,49,17,56,74,80,59,35,58,66,49,30,74,23,70,13,50,,56,75,60,46,-1,1,11,-5,-11,0,-2,12,5,7,-1,0,0,-4,0,0,"Southport and Formby District General Hospital Town Lane, Kew, Southport PR8 6PN, UK",53.6333043,-2.9792197
108,RBN,St Helens and Knowsley Hospitals NHS Trust,70,26,64,56,100,55,60,79,15,3,7,70,31,25,25,34,100,97,100,100,93,61,88,83,56,89,19,65,89,63,89,98,68,28,42,25,44,-3,45,40,14,50,86,49,18,30,-6,38,49,"Warrington Rd, Prescot, Rainhill, Prescot L35 5DR, UK",53.4212302,-2.7853229
109,RWJ,Stockport NHS Foundation Trust,82,61,100,85,90,75,80,79,50,28,82,86,60,33,67,81,90,84,85,92,87,63,86,81,76,45,40,55,64,67,97,88,64,6,3,-3,5,-6,10,12,8,5,17,-6,0,3,7,0,0,"Stockport SK2 7JE, UK",53.3827676,-2.1317531
110,RTP,Surrey and Sussex Healthcare NHS Trust,89,49,84,90,95,85,95,79,60,36,3,93,27,58,58,59,95,94,90,96,97,47,93,70,8,45,60,60,89,67,84,94,60,5,11,0,5,-1,5,1,18,0,9,5,0,20,2,9,11,"3NQ, Balcombe Rd, Crawley RH10 3ZF, UK",51.1356987,-0.1501175
111,RMP,Tameside Hospital NHS Foundation Trust,72,55,64,75,85,70,65,67,45,58,24,90,53,33,50,87,85,94,75,71,74,56,90,85,20,57,50,45,80,50,72,80,59,8,4,8,10,9,5,6,7,0,-1,-4,0,3,17,0,-2,"Fountain St, Ashton-under-Lyne OL6 9RW, UK",53.4930995,-2.0715971
112,RBA,Taunton and Somerset NHS Foundation Trust,71,36,73,70,85,75,60,67,45,11,11,67,28,17,48,62,100,97,95,96,90,43,81,61,16,23,45,60,59,58,81,96,50,25,14,8,30,12,20,36,23,15,12,5,14,15,28,10,-1,"Musgrove Park Hospital, Parkfield Dr, Taunton TA1 5DA, UK",51.0119619,-3.1196494
113,RBV,The Christie NHS Foundation Trust,62,29,45,65,75,60,45,67,10,25,31,52,40,25,29,16,100,100,100,83,85,67,86,87,76,89,85,90,100,67,81,94,83,32,54,36,35,25,40,38,18,80,64,45,34,27,60,38,71,"Wilmslow Rd, Manchester M20 4BX, UK",53.4295649,-2.228165
114,RNA,The Dudley Group NHS Foundation Trust,86,36,73,80,100,90,95,67,40,22,9,47,29,25,52,63,90,97,100,100,88,33,58,68,16,23,30,45,32,52,79,95,40,9,4,6,10,-3,10,5,21,5,1,7,11,4,5,0,5,"Dudley DY1 2HQ, UK",52.5023154,-2.1186984
115,RAS,The Hillingdon Hospitals NHS Foundation Trust,89,37,93,90,95,85,90,83,50,23,17,64,28,17,58,42,90,91,85,88,84,27,70,53,18,20,35,50,75,58,92,88,45,-1,8,-1,0,-4,0,-2,1,0,-3,1,6,-1,18,0,11,"Pield Heath Rd, Uxbridge UB8 3NN, UK",51.5252078,-0.4612385
116,RTD,The Newcastle Upon Tyne Hospitals NHS Foundation Trust,94,65,93,85,100,90,95,100,45,42,85,77,49,75,75,68,95,88,100,96,98,60,79,76,83,45,65,43,20,75,86,95,61,1,-4,-7,10,-12,10,1,-2,-2,3,-2,2,11,-10,0,8,"Freeman Rd, High Heaton, Newcastle upon Tyne NE7 7DN, UK",55.0025582,-1.5932643
117,RQW,The Princess Alexandra Hospital NHS Trust,76,31,66,81,90,65,70,75,25,42,15,46,13,8,44,56,90,78,85,71,82,42,83,84,32,57,40,30,91,64,80,81,58,5,27,14,9,-12,20,1,7,5,15,17,37,29,32,20,28,"Hamstel Rd, Harlow CM20 1QX, UK",51.7710499,0.0858092
118,RCX,The Queen Elizabeth Hospital Kings Lynn NHS Foundation Trust,35,14,32,44,20,35,45,33,15,6,16,27,13,17,21,0,55,50,30,50,63,24,35,27,16,5,13,25,61,22,60,50,25,15,11,28,11,30,-5,5,30,10,-1,0,8,11,-4,1,27,"Gayton Rd, King's Lynn PE30 4ET, UK",52.7566152,0.446967
119,RPC,The Queen Victoria Hospital NHS Foundation Trust,51,23,43,70,25,60,50,,55,0,6,25,14,50,0,33,80,63,85,58,84,27,25,56,5,0,35,40,59,29,61,74,31,23,8,18,10,38,25,8,,-15,0,-1,0,13,-15,29,23,"Holtye Rd, East Grinstead RH19 3DZ, UK",51.1353453,-0.0018081
120,RL1,The Robert Jones & Agnes Hunt Orthopaedic Hospital NHS Foundation Trust,60,33,73,50,50,40,70,88,15,36,10,38,38,63,29,31,70,66,70,67,82,39,53,33,13,33,63,30,55,46,75,71,41,11,8,2,20,16,30,-3,-6,15,-3,3,15,1,0,17,2,"Gobowen, Oswestry SY10 7AG, UK",52.8844671,-3.0335905
121,RFR,The Rotherham NHS Foundation Trust,79,42,57,81,85,85,70,75,10,48,14,79,41,33,50,58,80,81,85,83,81,62,80,77,40,64,45,57,75,65,83,82,63,3,21,26,-1,-4,0,13,6,47,16,26,1,21,12,15,19,"Moorgate Rd, Rotherham S60 2UD, UK",53.4142658,-1.3425348
122,RDZ,The Royal Bournemouth and Christchurch Hospitals NHS Foundation Trust,71,40,45,80,75,65,70,63,55,35,14,46,46,50,21,49,85,88,70,75,54,51,44,46,18,36,40,50,89,50,66,74,47,3,7,21,5,13,5,5,-9,-5,1,4,-2,5,-10,29,-3,"Castle Ln E, Bournemouth BH7 7DW, UK",50.7480068,-1.822257
123,RPY,The Royal Marsden NHS Foundation Trust,85,37,32,85,100,65,90,83,45,3,31,44,35,50,29,59,90,91,65,96,94,41,44,49,34,7,45,43,81,29,45,87,41,2,4,13,5,-9,0,6,11,-2,4,3,0,6,-5,0,-10,"Supplies Department Fulham Road, Chelsea, London SW3 6JJ, UK",51.4908714,-0.1727977
124,RRJ,The Royal Orthopaedic Hospital NHS Foundation Trust,66,18,52,75,80,65,45,63,15,8,3,33,8,0,42,32,75,72,65,46,63,8,30,37,3,13,15,45,63,50,67,64,29,-2,11,15,0,-8,0,1,0,30,5,0,-3,0,15,8,5,"The Woodlands, Bristol Rd S, Northfield, Birmingham B31 2AP, UK",52.4206669,-1.9610708
125,RL4,The Royal Wolverhampton NHS Trust,95,64,80,100,95,90,100,92,80,78,20,86,86,25,50,89,100,97,90,100,97,86,93,93,38,77,15,79,94,75,92,97,72,2,8,12,0,2,0,0,5,-1,-1,18,7,0,-10,25,4,"12, Corporate Services Centre, New Cross Hospital, Wolverhampton WV10 0QP, UK",52.5982537,-2.0948152
126,RET,The Walton Centre NHS Foundation Trust,98,58,82,100,100,90,100,100,65,60,54,63,62,50,50,57,100,97,100,100,98,62,74,49,51,61,80,70,73,58,80,99,64,1,6,-2,0,-3,10,0,-2,5,1,-3,11,0,30,8,-8,"Lower Ln, Liverpool L9 7LJ, UK",53.4664352,-2.9308819
127,RKE,The Whittington Hospital NHS Trust,52,47,64,63,45,35,55,63,35,43,69,80,33,25,23,64,100,91,80,75,92,59,86,76,72,48,15,64,78,27,79,88,58,36,11,15,37,46,45,20,29,29,5,3,6,26,-10,4,12,,,
128,R1G,Torbay and Southern Devon Health and Care NHS Trust,84,34,82,90,70,80,85,96,45,25,38,66,26,25,17,33,90,94,75,96,92,55,73,29,70,41,65,43,70,50,91,89,55,5,21,9,0,24,-5,11,-4,-2,16,32,7,29,40,33,-4,"Bay House/Nicholson Rd, Torquay TQ2 7TD, UK",50.4877399,-3.552757
129,RWD,United Lincolnshire Hospitals NHS Trust,75,40,52,85,70,70,75,75,35,42,9,61,22,25,63,60,80,78,85,75,77,36,61,62,8,36,15,50,66,50,67,79,43,4,3,15,-5,8,15,0,2,15,-6,-1,0,14,-10,-13,2,"United Lincolnshire Hospitals NHS Trust, 101 Manthorpe Rd, Grantham NG31 8DG, UK",52.9210011,-0.6406482
130,RRV,University College London Hospitals NHS Foundation Trust,80,30,70,85,90,80,80,67,25,17,51,53,24,17,20,34,80,78,70,79,74,31,69,41,67,14,10,25,45,18,66,76,36,-4,6,-4,-5,-12,-10,-1,7,0,-3,16,16,7,-7,-2,7,"Euston Rd, Kings Cross, London WC1H 8ND, UK",51.5297361,-0.1247568
131,RJE,University Hospital Of North Staffordshire NHS Trust,82,54,89,88,85,80,75,83,65,40,13,95,55,42,50,73,100,100,90,96,89,44,87,70,17,48,38,47,77,54,85,95,54,13,0,-4,12,15,10,21,6,-18,8,4,-8,-11,-4,4,-3,"Newcastle Rd, Stoke-on-Trent ST4 6QG, UK",53.0038144,-2.2129403
132,RM2,University Hospital Of South Manchester NHS Foundation Trust,62,31,36,70,65,70,60,46,20,17,14,62,18,17,87,13,80,88,60,88,67,53,93,40,25,55,35,54,58,33,78,77,50,15,19,42,10,23,-10,28,21,34,38,11,31,35,18,-54,27,"Southmoor Rd, Roundthorn Industrial Estate, Wythenshawe, Manchester M23 9LT, UK",53.3890982,-2.2931686
133,RRK,University Hospitals Birmingham NHS Foundation Trust,95,75,98,100,100,100,100,75,65,95,99,77,69,50,58,89,100,100,100,100,88,72,83,86,99,91,80,70,93,58,97,98,81,3,6,-1,0,0,0,0,13,5,-4,0,6,3,30,0,-3,"Priestley Wharf, Holt St, Birmingham B7 4BN, UK",52.487897,-1.8863477
134,RA7,University Hospitals Bristol NHS Foundation Trust,87,50,55,90,100,90,85,71,50,45,15,78,55,42,46,69,100,97,95,92,70,65,85,79,25,48,35,60,70,58,77,91,58,4,8,22,10,-3,5,7,-1,10,3,10,7,10,-7,12,10,"Trust Headquarters, Marlborough St, Bristol BS1 3NU, UK",51.4600795,-2.5953723
135,RKB,University Hospitals Coventry and Warwickshire NHS,85,44,82,95,100,75,70,83,35,47,29,69,49,25,40,56,95,97,85,79,82,43,75,61,29,55,40,55,80,46,83,88,54,3,10,1,0,-3,10,9,-1,20,8,0,6,-6,15,6,5,"Clifford Bridge Rd, Coventry CV2 2DX, UK",52.4211586,-1.4376872
136,RWE,University Hospitals Of Leicester NHS Trust,90,65,82,80,100,90,90,92,75,42,74,87,63,17,83,78,80,100,100,92,98,65,89,85,77,45,10,71,82,83,82,94,67,4,2,0,0,0,10,2,6,-4,3,3,2,2,-7,0,7,"Infirmary Square, Leicester LE1 5WW, UK",52.6255559,-1.1355658
137,RTX,University Hospitals Of Morecambe Bay NHS Trust,72,40,68,65,75,55,75,88,45,25,26,58,45,33,54,33,100,97,95,96,93,68,77,80,35,61,55,65,73,58,95,96,64,24,24,27,35,22,40,21,5,20,36,9,19,23,22,4,47,"Burton Rd, Kendal LA9 7RG, UK",54.3069142,-2.7346238
138,RHM,University Hospitals Southampton NHS Foundation Trust,63,58,68,75,85,55,60,38,50,36,72,83,54,58,33,79,100,100,94,88,70,85,92,85,72,55,65,70,80,58,82,90,74,27,16,14,25,15,39,28,32,20,19,0,9,31,7,25,6,"Southampton General Hospital, Tremona Rd, Southampton SO16 6YD, UK",50.9336562,-1.4346812
139,RBK,Walsall Healthcare NHS Trust,69,54,68,69,55,75,75,71,45,65,13,87,66,50,23,86,81,78,80,83,71,68,92,80,30,70,50,46,75,62,77,79,64,10,10,9,12,23,5,8,0,1,5,17,5,2,0,39,-6,"Moat Rd, Walsall WS2 9PS, UK",52.5829306,-1.9986992
140,RWW,Warrington and Halton Hospitals NHS Foundation Trust,90,43,91,100,100,90,95,67,60,11,17,96,40,0,67,51,100,100,100,100,94,60,100,88,33,61,15,60,91,50,100,99,62,9,19,9,0,0,10,5,27,0,50,16,4,20,15,-17,37,"Lovely Ln, Warrington WA5 1QG, UK",53.3940422,-2.6108215
141,RWG,West Hertfordshire Hospitals NHS Trust,58,23,43,38,70,65,50,67,15,6,8,48,16,8,30,49,56,66,75,54,70,16,54,54,8,8,25,25,56,30,54,64,31,6,8,11,18,-4,10,4,3,10,2,0,6,0,17,0,5,"Vicarage Rd, Watford WD18 0HB, UK",51.648538,-0.4036239
142,RGR,West Suffolk NHS Foundation Trust,84,31,59,80,90,85,85,79,30,22,16,52,21,25,42,41,90,97,95,88,80,47,88,61,71,50,20,50,27,48,73,90,51,6,20,14,10,7,10,3,1,20,28,55,36,26,-5,6,20,"Hardwick Ln, Bury St Edmunds, Bury Saint Edmunds IP33 2QZ, UK",52.2316146,0.709248
143,RYR,Western Sussex Hospitals NHS Trust,89,67,93,75,80,95,95,100,45,75,89,64,50,42,100,67,100,88,90,96,80,62,65,77,89,70,40,50,91,96,89,91,71,2,4,-4,25,8,-5,1,-20,5,-5,0,1,12,-2,-4,10,"Spitalfield La, Chichester PO19 6SE, UK",50.8435533,-0.7680076
144,RA3,Weston Area Health NHS Trust,55,30,43,75,50,30,45,75,25,0,21,51,25,33,33,50,69,72,30,58,75,36,74,57,25,0,20,25,52,33,63,61,36,6,6,20,-6,22,0,13,0,0,0,4,23,11,-13,0,7,"Grange Rd, Uphill, Weston-super-Mare BS23 4TQ, UK",51.32237,-2.9725926
145,RBL,Wirral University Teaching Hospital NHS Foundation Trust,87,79,89,95,95,85,80,79,80,95,57,96,74,50,88,93,100,100,100,92,96,87,100,97,82,95,60,85,95,92,98,98,88,11,9,9,5,5,15,12,17,5,0,25,4,13,10,4,4,"Arrowe Park Hospital, Arrowe Park Rd, Birkenhead, Wirral CH49 5PE, UK",53.3690502,-3.0955279
146,RWP,Worcestershire Acute Hospitals NHS Trust,79,46,64,75,69,80,90,83,50,50,35,76,38,17,60,42,95,86,100,100,94,35,74,58,14,32,35,50,61,71,58,95,48,16,2,-6,20,17,20,10,11,0,-18,-21,-2,-3,18,11,16,"Charles Hastings Way, Worcester WR5 1DD, UK",52.1912499,-2.1811171
147,RRF,"Wrightington, Wigan and Leigh NHS Foundation Trust",69,29,73,75,80,70,70,50,25,6,6,55,32,42,29,39,80,81,70,88,85,65,88,73,67,61,35,55,75,71,97,81,66,12,37,24,5,1,0,18,35,30,55,61,33,33,-7,42,34,"Hall Ln, Appley Bridge, Wigan WN6 9EP, UK",53.5905035,-2.7118897
148,RLQ,Wye Valley NHS Trust,67,27,50,85,90,45,75,42,30,19,30,37,11,25,38,22,80,72,55,75,60,19,46,33,31,34,25,29,83,45,60,68,38,1,11,10,-5,-18,10,0,18,-1,15,1,9,8,0,7,11,"Stonebow Rd, Hereford HR1 2ER, UK",52.0574483,-2.7058348
149,RA4,Yeovil District Hospital NHS Foundation Trust,75,36,55,100,100,50,65,58,40,31,16,42,27,50,53,27,100,97,100,96,89,53,61,72,20,50,60,65,77,83,86,96,60,21,24,31,0,-3,50,31,31,25,19,4,19,26,10,30,45,"Higher Kingston, Yeovil BA21 4AT, UK",50.9447524,-2.6343106
150,RCB,York Teaching Hospital NHS Foundation Trust,66,64,77,65,85,70,65,46,65,78,30,80,72,50,46,93,85,91,80,83,83,74,90,97,31,82,45,61,97,58,85,84,71,18,7,8,20,6,10,18,37,-4,4,1,10,2,-5,12,4,"Wigginton Rd, Clifton, York YO31 8HE, UK",53.9699817,-1.083555
